datum,gruppe,kategorie,trend,aktueller_wert,veraenderung_%,affiliate_score,empfohlene_partner,keywords
2026-03-25,Familie & Kinder,Familie,steigend ↑,35.7,18.4,84.1,"Amazon, myToys, baby-walz, Jako-o","Kinderfahrrad, Spielzeug kaufen, Kinderwagen, Schulranzen, Babyausstattung"
2026-03-25,Mode & Lifestyle,Mode,steigend ↑,27.1,25.2,67.1,"Zalando, AboutYou, Amazon, Otto","Winterjacke kaufen, Sneaker, Kleidung online, Handtasche, Schmuck"
2026-03-25,Heimwerken & Garten,Heim & Garten,steigend ↑,26.0,133.8,66.0,"OBI, Hornbach, Amazon, Bauhaus","Rasenmäher, Werkzeug kaufen, Gartenmöbel, Bohrmaschine, Gartenhaus"
2026-03-25,Fahrrad & Outdoor,Sport & Outdoor,steigend ↑,12.8,17.4,50.2,"Decathlon, Amazon, Fahrrad.de, Bergfreunde","Fahrrad kaufen, E-Bike, Fahrradreparatur, Camping, Wanderschuhe"
2026-03-25,Gesundheit & Fitness,Gesundheit,fallend ↓,26.7,-11.4,26.7,"Myprotein, Amazon, SportScheck, Gymondo","Fitnessstudio, Protein kaufen, Laufschuhe, Yoga, Heimtrainer"
2026-03-25,Elektronik & Technik,Elektronik,fallend ↓,26.5,-10.0,26.5,"MediaMarkt, Amazon, Alternate, Notebooksbilliger","Smartphone kaufen, Laptop günstig, Fernseher, Kopfhörer, Tablet"
