datum,gruppe,kategorie,trend,aktueller_wert,veraenderung_%,affiliate_score,empfohlene_partner,keywords
2026-03-18,Familie & Kinder,Familie,steigend ↑,35.6,21.5,85.6,"Amazon, myToys, baby-walz, Jako-o","Kinderfahrrad, Spielzeug kaufen, Kinderwagen, Schulranzen, Babyausstattung"
2026-03-18,Mode & Lifestyle,Mode,steigend ↑,26.4,36.9,66.4,"Zalando, AboutYou, Amazon, Otto","Winterjacke kaufen, Sneaker, Kleidung online, Handtasche, Schmuck"
2026-03-18,Heimwerken & Garten,Heim & Garten,steigend ↑,22.1,152.6,62.1,"OBI, Hornbach, Amazon, Bauhaus","Rasenmäher, Werkzeug kaufen, Gartenmöbel, Bohrmaschine, Gartenhaus"
2026-03-18,Fahrrad & Outdoor,Sport & Outdoor,steigend ↑,13.2,31.3,53.2,"Decathlon, Amazon, Fahrrad.de, Bergfreunde","Fahrrad kaufen, E-Bike, Fahrradreparatur, Camping, Wanderschuhe"
2026-03-18,Gesundheit & Fitness,Gesundheit,stabil →,28.1,-4.7,38.1,"Myprotein, Amazon, SportScheck, Gymondo","Fitnessstudio, Protein kaufen, Laufschuhe, Yoga, Heimtrainer"
2026-03-18,Elektronik & Technik,Elektronik,fallend ↓,27.5,-8.9,27.5,"MediaMarkt, Amazon, Alternate, Notebooksbilliger","Smartphone kaufen, Laptop günstig, Fernseher, Kopfhörer, Tablet"
