datum,gruppe,kategorie,trend,aktueller_wert,veraenderung_%,affiliate_score,empfohlene_partner,keywords
2026-04-06,Heimwerken & Garten,Heim & Garten,steigend ↑,21.8,14.7,56.5,"OBI, Hornbach, Amazon, Bauhaus","Rasenmäher, Werkzeug kaufen, Gartenmöbel, Bohrmaschine, Gartenhaus"
2026-04-06,Fahrrad & Outdoor,Sport & Outdoor,steigend ↑,14.0,20.3,54.0,"Decathlon, Amazon, Fahrrad.de, Bergfreunde","Fahrrad kaufen, E-Bike, Fahrradreparatur, Camping, Wanderschuhe"
2026-04-06,Familie & Kinder,Familie,fallend ↓,31.2,-9.8,41.2,"Amazon, myToys, baby-walz, Jako-o","Kinderfahrrad, Spielzeug kaufen, Kinderwagen, Schulranzen, Babyausstattung"
2026-04-06,Elektronik & Technik,Elektronik,stabil →,28.5,-0.3,38.5,"MediaMarkt, Amazon, Alternate, Notebooksbilliger","Smartphone kaufen, Laptop günstig, Fernseher, Kopfhörer, Tablet"
2026-04-06,Mode & Lifestyle,Mode,stabil →,24.9,-0.6,34.9,"Zalando, AboutYou, Amazon, Otto","Winterjacke kaufen, Sneaker, Kleidung online, Handtasche, Schmuck"
2026-04-06,Gesundheit & Fitness,Gesundheit,fallend ↓,26.4,-11.1,26.4,"Myprotein, Amazon, SportScheck, Gymondo","Fitnessstudio, Protein kaufen, Laufschuhe, Yoga, Heimtrainer"
