datum,gruppe,kategorie,trend,aktueller_wert,veraenderung_%,affiliate_score,empfohlene_partner,keywords
2026-02-25,Mode & Lifestyle,Mode,steigend ↑,21.1,15.9,57.0,"Zalando, AboutYou, Amazon, Otto","Winterjacke kaufen, Sneaker, Kleidung online, Handtasche, Schmuck"
2026-02-25,Fahrrad & Outdoor,Sport & Outdoor,steigend ↑,11.0,20.1,51.0,"Decathlon, Amazon, Fahrrad.de, Bergfreunde","Fahrrad kaufen, E-Bike, Fahrradreparatur, Camping, Wanderschuhe"
2026-02-25,Heimwerken & Garten,Heim & Garten,steigend ↑,10.0,42.1,50.0,"OBI, Hornbach, Amazon, Bauhaus","Rasenmäher, Werkzeug kaufen, Gartenmöbel, Bohrmaschine, Gartenhaus"
2026-02-25,Familie & Kinder,Familie,stabil →,29.8,0.7,40.5,"Amazon, myToys, baby-walz, Jako-o","Kinderfahrrad, Spielzeug kaufen, Kinderwagen, Schulranzen, Babyausstattung"
2026-02-25,Gesundheit & Fitness,Gesundheit,stabil →,30.0,-2.4,40.0,"Myprotein, Amazon, SportScheck, Gymondo","Fitnessstudio, Protein kaufen, Laufschuhe, Yoga, Heimtrainer"
2026-02-25,Elektronik & Technik,Elektronik,fallend ↓,28.6,-6.8,28.6,"MediaMarkt, Amazon, Alternate, Notebooksbilliger","Smartphone kaufen, Laptop günstig, Fernseher, Kopfhörer, Tablet"
