datum,gruppe,kategorie,trend,aktueller_wert,veraenderung_%,affiliate_score,empfohlene_partner,keywords
2026-05-02,Heimwerken & Garten,Heim & Garten,steigend ↑,31.6,41.1,81.6,"OBI, Hornbach, Amazon, Bauhaus","Rasenmäher, Werkzeug kaufen, Gartenmöbel, Bohrmaschine, Gartenhaus"
2026-05-02,Fahrrad & Outdoor,Sport & Outdoor,steigend ↑,15.0,16.2,51.2,"Decathlon, Amazon, Fahrrad.de, Bergfreunde","Fahrrad kaufen, E-Bike, Fahrradreparatur, Camping, Wanderschuhe"
2026-05-02,Familie & Kinder,Familie,fallend ↓,30.6,-7.8,40.6,"Amazon, myToys, baby-walz, Jako-o","Kinderfahrrad, Spielzeug kaufen, Kinderwagen, Schulranzen, Babyausstattung"
2026-05-02,Mode & Lifestyle,Mode,stabil →,24.0,-1.2,34.0,"Zalando, AboutYou, Amazon, Otto","Winterjacke kaufen, Sneaker, Kleidung online, Handtasche, Schmuck"
2026-05-02,Gesundheit & Fitness,Gesundheit,fallend ↓,25.7,-5.9,25.7,"Myprotein, Amazon, SportScheck, Gymondo","Fitnessstudio, Protein kaufen, Laufschuhe, Yoga, Heimtrainer"
2026-05-02,Elektronik & Technik,Elektronik,fallend ↓,25.0,-11.5,25.0,"MediaMarkt, Amazon, Alternate, Notebooksbilliger","Smartphone kaufen, Laptop günstig, Fernseher, Kopfhörer, Tablet"
