datum,gruppe,kategorie,trend,aktueller_wert,veraenderung_%,affiliate_score,empfohlene_partner,keywords
2026-03-22,Familie & Kinder,Familie,steigend ↑,33.8,15.0,78.8,"Amazon, myToys, baby-walz, Jako-o","Kinderfahrrad, Spielzeug kaufen, Kinderwagen, Schulranzen, Babyausstattung"
2026-03-22,Mode & Lifestyle,Mode,steigend ↑,25.4,21.8,65.4,"Zalando, AboutYou, Amazon, Otto","Winterjacke kaufen, Sneaker, Kleidung online, Handtasche, Schmuck"
2026-03-22,Heimwerken & Garten,Heim & Garten,steigend ↑,23.8,116.9,63.8,"OBI, Hornbach, Amazon, Bauhaus","Rasenmäher, Werkzeug kaufen, Gartenmöbel, Bohrmaschine, Gartenhaus"
2026-03-22,Gesundheit & Fitness,Gesundheit,fallend ↓,25.5,-15.9,25.5,"Myprotein, Amazon, SportScheck, Gymondo","Fitnessstudio, Protein kaufen, Laufschuhe, Yoga, Heimtrainer"
2026-03-22,Fahrrad & Outdoor,Sport & Outdoor,stabil →,11.3,4.1,25.4,"Decathlon, Amazon, Fahrrad.de, Bergfreunde","Fahrrad kaufen, E-Bike, Fahrradreparatur, Camping, Wanderschuhe"
2026-03-22,Elektronik & Technik,Elektronik,fallend ↓,25.0,-13.2,25.0,"MediaMarkt, Amazon, Alternate, Notebooksbilliger","Smartphone kaufen, Laptop günstig, Fernseher, Kopfhörer, Tablet"
