datum,gruppe,kategorie,trend,aktueller_wert,veraenderung_%,affiliate_score,empfohlene_partner,keywords
2026-03-28,Familie & Kinder,Familie,steigend ↑,34.8,17.1,81.9,"Amazon, myToys, baby-walz, Jako-o","Kinderfahrrad, Spielzeug kaufen, Kinderwagen, Schulranzen, Babyausstattung"
2026-03-28,Mode & Lifestyle,Mode,steigend ↑,26.0,27.4,66.0,"Zalando, AboutYou, Amazon, Otto","Winterjacke kaufen, Sneaker, Kleidung online, Handtasche, Schmuck"
2026-03-28,Heimwerken & Garten,Heim & Garten,steigend ↑,24.6,127.3,64.6,"OBI, Hornbach, Amazon, Bauhaus","Rasenmäher, Werkzeug kaufen, Gartenmöbel, Bohrmaschine, Gartenhaus"
2026-03-28,Fahrrad & Outdoor,Sport & Outdoor,steigend ↑,12.8,18.5,51.3,"Decathlon, Amazon, Fahrrad.de, Bergfreunde","Fahrrad kaufen, E-Bike, Fahrradreparatur, Camping, Wanderschuhe"
2026-03-28,Elektronik & Technik,Elektronik,fallend ↓,26.6,-9.5,26.6,"MediaMarkt, Amazon, Alternate, Notebooksbilliger","Smartphone kaufen, Laptop günstig, Fernseher, Kopfhörer, Tablet"
2026-03-28,Gesundheit & Fitness,Gesundheit,fallend ↓,26.5,-13.0,26.5,"Myprotein, Amazon, SportScheck, Gymondo","Fitnessstudio, Protein kaufen, Laufschuhe, Yoga, Heimtrainer"
