datum,gruppe,kategorie,trend,aktueller_wert,veraenderung_%,affiliate_score,empfohlene_partner,keywords
2026-07-08,Heimwerken & Garten,Heim & Garten,fallend ↓,26.1,-27.5,26.1,"OBI, Hornbach, Amazon, Bauhaus","Rasenmäher, Werkzeug kaufen, Gartenmöbel, Bohrmaschine, Gartenhaus"
2026-07-08,Elektronik & Technik,Elektronik,fallend ↓,25.2,-5.4,25.2,"MediaMarkt, Amazon, Alternate, Notebooksbilliger","Smartphone kaufen, Laptop günstig, Fernseher, Kopfhörer, Tablet"
2026-07-08,Familie & Kinder,Familie,fallend ↓,24.5,-11.7,24.5,"Amazon, myToys, baby-walz, Jako-o","Kinderfahrrad, Spielzeug kaufen, Kinderwagen, Schulranzen, Babyausstattung"
2026-07-08,Gesundheit & Fitness,Gesundheit,fallend ↓,21.6,-16.8,21.6,"Myprotein, Amazon, SportScheck, Gymondo","Fitnessstudio, Protein kaufen, Laufschuhe, Yoga, Heimtrainer"
2026-07-08,Fahrrad & Outdoor,Sport & Outdoor,fallend ↓,16.2,-15.2,16.2,"Decathlon, Amazon, Fahrrad.de, Bergfreunde","Fahrrad kaufen, E-Bike, Fahrradreparatur, Camping, Wanderschuhe"
