datum,gruppe,kategorie,trend,aktueller_wert,veraenderung_%,affiliate_score,empfohlene_partner,keywords
2026-03-04,Mode & Lifestyle,Mode,steigend ↑,22.8,22.3,62.8,"Zalando, AboutYou, Amazon, Otto","Winterjacke kaufen, Sneaker, Kleidung online, Handtasche, Schmuck"
2026-03-04,Familie & Kinder,Familie,stabil →,31.6,4.1,55.7,"Amazon, myToys, baby-walz, Jako-o","Kinderfahrrad, Spielzeug kaufen, Kinderwagen, Schulranzen, Babyausstattung"
2026-03-04,Heimwerken & Garten,Heim & Garten,steigend ↑,15.6,101.9,55.6,"OBI, Hornbach, Amazon, Bauhaus","Rasenmäher, Werkzeug kaufen, Gartenmöbel, Bohrmaschine, Gartenhaus"
2026-03-04,Fahrrad & Outdoor,Sport & Outdoor,steigend ↑,12.1,21.0,52.1,"Decathlon, Amazon, Fahrrad.de, Bergfreunde","Fahrrad kaufen, E-Bike, Fahrradreparatur, Camping, Wanderschuhe"
2026-03-04,Gesundheit & Fitness,Gesundheit,stabil →,31.0,-3.4,51.0,"Myprotein, Amazon, SportScheck, Gymondo","Fitnessstudio, Protein kaufen, Laufschuhe, Yoga, Heimtrainer"
2026-03-04,Elektronik & Technik,Elektronik,fallend ↓,27.8,-10.0,27.8,"MediaMarkt, Amazon, Alternate, Notebooksbilliger","Smartphone kaufen, Laptop günstig, Fernseher, Kopfhörer, Tablet"
